[
  {
    "title": "Sunny 2BR Apartment in Downtown",
    "description": "Close to transit, renovated kitchen, pets ok.",
    "photos": ["https://picsum.photos/seed/apt1/512/512"],
    "priceCents": 24500000,
    "currency": "usd",
    "period": "mo",
    "beds": 2,
    "baths": 1,
    "sqft": 900,
    "address": "123 Main St, San Francisco, CA",
    "geo": { "lat": 37.7749, "lng": -122.4194 },
    "amenities": ["PARKING", "ELEVATOR", "LAUNDRY"],
    "availabilityDate": "2025-11-01",
    "category": "RENT",
    "propertyType": "APARTMENT",
    "visibility": "public"
  },
  {
    "title": "Family House with Backyard",
    "photos": ["https://picsum.photos/seed/house2/512/512"],
    "priceCents": 78500000,
    "currency": "usd",
    "beds": 4,
    "baths": 3,
    "sqft": 2200,
    "address": "456 Oak Ave, Austin, TX",
    "geo": { "lat": 30.2672, "lng": -97.7431 },
    "amenities": ["GARAGE", "GARDEN"],
    "category": "SALE",
    "propertyType": "HOUSE",
    "visibility": "public"
  },
  {
    "title": "Modern Condo with City Views",
    "photos": ["https://picsum.photos/seed/condo3/512/512"],
    "priceCents": 32000000,
    "currency": "usd",
    "period": "mo",
    "beds": 1,
    "baths": 1,
    "sqft": 700,
    "address": "789 Pine St, Seattle, WA",
    "geo": { "lat": 47.6062, "lng": -122.3321 },
    "amenities": ["GYM", "POOL", "CONCIERGE"],
    "category": "RENT",
    "propertyType": "CONDO",
    "visibility": "public"
  },
  {
    "title": "Townhouse Near Tech Park",
    "photos": ["https://picsum.photos/seed/town4/512/512"],
    "priceCents": 51000000,
    "currency": "usd",
    "beds": 3,
    "baths": 2,
    "sqft": 1500,
    "address": "12 Innovation Dr, Raleigh, NC",
    "geo": { "lat": 35.7796, "lng": -78.6382 },
    "amenities": ["PATIO", "WALK-IN CLOSET"],
    "category": "SALE",
    "propertyType": "TOWNHOUSE",
    "visibility": "public"
  },
  {
    "title": "Starter Home with Potential",
    "photos": ["https://picsum.photos/seed/house5/512/512"],
    "priceCents": 29900000,
    "currency": "usd",
    "beds": 2,
    "baths": 1,
    "sqft": 1100,
    "address": "99 Elm St, Columbus, OH",
    "geo": { "lat": 39.9612, "lng": -82.9988 },
    "amenities": ["BASEMENT", "FENCED YARD"],
    "category": "SALE",
    "propertyType": "HOUSE",
    "visibility": "public"
  }
]
